ID,Title,Author,Year,Format,File
1,Just a Friend to You,Ega Dyp,2020,PDF,ebook/Ega Dyp - Just a Friend to You.pdf
2,Dead Space - Extraction,Antony Johnston & Ben Templesmith,2009,PDF,ebook/Dead Space - Extraction (2009) (c2c) (Legion-CPS)_copy.pdf
3,The Sum of All Fears,Tom Clancy,1991,PDF,ebook/Tom Clancy - The Sum of All Fears_copy.pdf
4,Ubur-Ubur Lembur,Raditya Dika,2018,PDF,ebook/Ubur- ubur lembur Raditya Dika.pdf
5,Dead Space - Salvage,Antony Johnston,2008,PDF,ebook/Dead_Space_Salvage_(2010)_copy.pdf
